{
  "$schema": "https://json-schema.org/draft/2020-12/schema",
  "$id": "https://tayaa710.github.io/ai-opt-out/spec/ai-training-opt-out.schema.json",
  "title": "AI training opt-out disclosure (/.well-known/ai-training-opt-out), version 1",
  "description": "A service's machine-readable statement of whether it trains AI models on its users' content, and where users can opt out. See spec/well-known-ai-training-opt-out.md.",
  "type": "object",
  "required": ["version", "trains_on_user_content", "last_updated"],
  "properties": {
    "version": {
      "const": 1,
      "description": "Format version. Consumers reject documents with a version they do not support."
    },
    "name": {
      "type": "string",
      "minLength": 1,
      "maxLength": 100,
      "description": "Human-readable name of the service."
    },
    "trains_on_user_content": {
      "enum": ["yes", "no", "conditional"],
      "description": "yes: user content is used to train or improve AI models. no: it is not. conditional: only for some products, plans, regions or features; policy_url explains which."
    },
    "default": {
      "enum": ["opted_in", "opted_out", "no_choice"],
      "description": "What happens if the user does nothing. opted_in: training is on until the user opts out. opted_out: training is off unless the user opts in. no_choice: the user cannot change it."
    },
    "opt_out_url": {
      "type": "string",
      "format": "uri",
      "pattern": "^https://",
      "maxLength": 2048,
      "description": "Page where a signed-in user can opt out (the exact setting or form). Same site as the host serving the document. Required unless trains_on_user_content is \"no\"."
    },
    "policy_url": {
      "type": "string",
      "format": "uri",
      "pattern": "^https://",
      "maxLength": 2048,
      "description": "The section of the privacy policy or AI terms that describes training on user content."
    },
    "data_types": {
      "type": "array",
      "maxItems": 20,
      "uniqueItems": true,
      "items": {
        "type": "string",
        "minLength": 1,
        "maxLength": 50,
        "examples": [
          "chats",
          "files",
          "voice",
          "images",
          "video",
          "posts",
          "comments",
          "messages",
          "code",
          "documents",
          "profile",
          "activity",
          "feedback",
          "creative-works"
        ]
      },
      "description": "Kinds of user content used for training. Use the registered vocabulary where it fits."
    },
    "regions": {
      "type": "array",
      "minItems": 1,
      "uniqueItems": true,
      "items": {
        "type": "string",
        "examples": ["ALL", "EU", "UK", "CH", "US", "US-CA", "CA", "AU", "BR", "IN", "JP", "OTHER"]
      },
      "description": "Regions where the statements in this document apply. \"ALL\" means everywhere. Consumers ignore codes they do not know."
    },
    "last_updated": {
      "type": "string",
      "pattern": "^\\d{4}-\\d{2}-\\d{2}$",
      "format": "date",
      "description": "Date (YYYY-MM-DD) the statements in this document were last reviewed or changed."
    },
    "contact": {
      "type": "string",
      "maxLength": 254,
      "anyOf": [{ "format": "email" }, { "pattern": "^https://", "format": "uri" }],
      "description": "Where users can send privacy questions or requests: an email address or an https URL."
    }
  },
  "allOf": [
    {
      "if": {
        "properties": { "trains_on_user_content": { "enum": ["yes", "conditional"] } },
        "required": ["trains_on_user_content"]
      },
      "then": { "required": ["opt_out_url"] }
    }
  ]
}
